{
  "passage_id": "DEMO-C:001",
  "items": [
    {
      "id": "E1",
      "actor": "teams",
      "conduct": "share unsuccessful results",
      "timing": "monthly",
      "status": "ongoing",
      "content_type": "routine",
      "direction": "required",
      "origin": "internal",
      "scope": {
        "type": "unit or function",
        "target": "teams",
        "extent": "all"
      },
      "qualifications": [
        "must share"
      ],
      "excerpt": "teams must share unsuccessful results at monthly reviews"
    }
  ],
  "unresolved": [],
  "completeness_uncertain": false
}